<?xml version="1.0" encoding="Windows1251"?>
<?xml-stylesheet type="text/css" href="css/text.css"?>
<!DOCTYPE note [
<!ELEMENT note (first, second, third, four, five)>
<!ELEMENT first (#PCDATA)>
<!ELEMENT second (#PCDATA)>
<!ELEMENT third (#PCDATA)>
<!ELEMENT four (#PCDATA)>
<!ELEMENT five (#PCDATA)>
<!ENTITY sus "MicroSD">
]>

<note>
<first>
Наше компрессионное термобелье для мужчин — это превосходное решение для разнообразных активностей на свежем воздухе. Одной из ключевых особенностей этого комплекта одежды является использование флиса с начесом, который обеспечивает отличное удержание тепла и комфорт при ношении. Флисовое белье создаст идеальное микроклиматическое окружение для вашего тела, сохраняя его тепло в любых погодных условиях. Это особенно важно для тех, кто активно занимается зимними видами спорта, такие как хоккей или поход. Спортивная коллекция станет вашим верным помощником в сложных ситуациях, таких как армейские военные учения, рыбалка или охота. Каждый компонент набора термо белья индивидуально разработан, чтобы соответствовать самым строгим критериям. Ткань, из которой изготовлен костюм, обладает замечательными теплоизоляционными свойствами, защищая от холодов и даруя приятное ощущение тепла. Даже в переходные сезоны, такие как осень или весна, вы будете чувствовать себя уютно. Отличительная особенность термокомплекта – это его долговечность. Вещи легко стираются и быстро сохнут, при этом не теряя своих свойств и внешнего вида после многих стирок. Эта термоодежда сочетает в себе эстетику и практичность, представляя собой комплект с удобной кофтой с длинным рукавом и лосинами. Современные технологии, используемые в производстве, обеспечивают отличное отведение влаги, что делает комплект идеальным выбором для интенсивных активностей. Наш товар представлен в различных размерах, чтобы каждый мог выбрать идеальный вариант для себя, независимо от роста или комплекции. Не имеет значения, предпочитаете ли вы активные поездки на природу или вам нужны теплые спортивки и кофта для спокойных прогулок — у нас есть решение. Наше изделие станет надежными помощниками и позволят наслаждаться временем на свежем воздухе долговременно и с удовольствием.
</first>
<second>
В КОМПЛЕКТЕ: &sus; НА 64Гб (внутри камеры), кapтpидep, УДЛИНEHHЫЙ KAБEЛЬ 3м для быстрого монтажа + ПОДАРОК.
Двухобъективная система видеонаблюдения 3+3МП обеспечит безопасность квартиры и дома. Смарт камера дневного и ночного видения с инфракрасной LED-подсветкой ведет наблюдение круглосуточно. Запись сохраняется в облачное хранилище или на карту памяти до 128 ГБ. Высокое качество разрешения и широкий угол обзора дает четкое видео в мельчайших подробностях. Частота кадров 25 к/с. Имеет круговой обзор на 360 градусов и вертикальный – на 90. Умная поворотная камера распознает человека и следит за объектом. Ip камера уличная оснащена датчиком движения со звуковой и световой сигнализацией и отправляет уведомления на ваш гаджет. В детской комнате выполняет функции радионяни – ваш малыш будет под присмотром. Купольная домашняя камера – идеальный уличный вариант слежения за входом в подъезд. Двусторонняя аудиосвязь через портативный микрофон и динамик, передача звука в режиме реального времени в обе стороны делают видеокамеру отличной альтернативой домофону. Можно использовать как проводной, так и беспроводной способ работы с подключением к Wifi (сеть 2,4 ГГц). Маленький прибор без проводов просто разместить на улице в секретном месте. Для наружного крепления имеется все необходимое. Усиленная конструкция и защита от пыли и воды IP 66 позволяет технике стабильно работать и в дождь, и в снег.
Удобно управлять камерой через телефон позволяет приложение: смотрите видео в режиме онлайн или записи событий. Подойдут телефоны на Android и iOS. Управление онлайн возможно одновременно с нескольких устройств.
В комплекте руководство на русском языке. В нем есть ссылка на подробные видеоинструкции с объяснением всех возможностей камеры, доступ к чат-боту с ответами на частые вопросы и круглосуточную техническую поддержку.
</second>
<third>
Швабра с отжимом и ведром Smart Mop - идеальное решение для быстрой и эффективной уборки. Она разработана с учетом основных потребностей пользователей.
Главным преимуществом швабры Smart Mop является её инновационная система отжима. Убирайте грязь и излишки воды с насадки всего за несколько секунд. Благодаря ведру объемом 7 литров, разделенным на два отсека — один для полоскания и второй для отжима, Вы получите управление процессом уборки на новом уровне. Эта удобно продуманная конструкция исключает контакт Ваших рук с грязной водой и ускоряет работу в несколько раз.
Трехкомпонентная насадка из микрофибры Tri-Clean способна эффективно впитывать и удерживать жидкость, собирать пыль, шерсть, волосы и справляться даже с самыми стойкими загрязнениями. Она идеально подходит для мытья полов, независимо от типа покрытия. Более того, насадки можно стирать не только вручную, но и в стиральной машине при температуре 30-40 градусов, что обеспечивает их долговечность и легкость в обслуживании. Мы рекомендуем менять насадку каждые три месяца для достижения оптимального результата.
Швабра для пола Smart Mop станет вашим незаменимым помощником в уборке, позволяя не только эффективно удалять загрязнения, но и наслаждаться процессом. Эргономичный дизайн и ручка с покрытием soft-touch позволяют без труда дотянуться до самых труднодоступных мест.
Усиленная конструкция в местах соединения предотвращает возможные поломки и надежно фиксирует насадку во время работы.
Вы можете защитить свою покупку от любых поломок и брака, просто активировав гарантию 365 дней на нашем сайте. Даже если поломка произошла в ходе эксплуатации, мы бесплатно направим Вам новый товар или недостающую деталь.
Инструкция по активации гарантии и сборке внутри коробки.
</third>
<four>
Шампунь PANTENE Pro-V (Пантин Про-Ви) Интенсивное Восстановление идеально подходит для ослабленных, поврежденных волос. Благодаря уникальному комплексу Pro-V он деликатно очищает волосы, насыщая их активными питательными веществами, и способствует восстановлению волос по всей длине. Шампунь мгновенно устраняет ломкость и признаки повреждений, предотвращает появление секущихся кончиков и возвращает волосам гладкость и здоровый блеск. Не содержит силиконов, минеральных масел и красителей. Подходит для окрашенных волос. Для достижения максимального эффекта используйте в сочетании с бальзамом-ополаскивателем и маской;дополните уход маслом и спреем для волос из серии Интенсивное Восстановление. Легендарный бренд PANTENE Pro-V заботится о здоровье и красоте волос женщин по всему миру уже более 75 лет. Сегодня Pantene - это богатый научный опыт ведущих экспертов и самые эффективные ингредиенты и питательные вещества, протестированные и одобренные Швейцарским Институтом Витаминов.
</four>
<five>
Удлинитель для гирлянд 2 штуки по 5 метров. Очень пригодится когда розетка не рядом, а гирлянду хочется повесить именно "здесь" особенно это касается гирлянды "штора" у которых обычно короткий провод Провод прозрачный и почти невидим, что очень удобно Удлинитель для гирлянд, подходит под любые типы гирлянд Прозрачный провод впишется в любую цветовую интерьерную гамму Такой удлинитель позволяет увеличить длину провода Использовать только для гирлянд Совместимы: гирлянда занавес, гирлянда штора, гирлянда на окно, гирлянда дождик, гирлянда сетка, гирлянда светодиодная, новогодняя гирлянда, гирлянда на елку, флажки гирлянда, гирлянда уличная бахрома, гирлянда для улицы, олень светодиодный, олень светодиодный новогодний.
</five>
</note>
